{
  "$schema": "https://json-schema.org/draft/2020-12/schema",
  "$id": "https://github.com/luckyPipewrench/agent-egress-bench/schemas/receipt-scoring-profile-v4.schema.json",
  "title": "agent-egress-bench Receipt-Scoring Profile",
  "description": "Per-tool receipt-scoring profile artifact described in docs/RECEIPT-SCORING.md. Records, for every applicable corpus case, whether the tool blocked the action, explained the verdict, produced a signed receipt, produced one that is independently verifiable, and whether it blocked a benign baseline. Profiles are evidence artifacts published by tool maintainers, not certifications.",
  "type": "object",
  "required": [
    "schema_version",
    "tool",
    "tool_version",
    "corpus_version",
    "corpus_sha256",
    "tool_profile_sha256",
    "capability_registry",
    "verifier",
    "summary",
    "per_case"
  ],
  "additionalProperties": false,
  "properties": {
    "schema_version": {
      "type": "integer",
      "const": 4,
      "description": "Schema version. Must be 4 for active scoring."
    },
    "tool": {
      "type": "string",
      "minLength": 1,
      "description": "Tool name (matches the tool field in the runner tool-profile)."
    },
    "tool_version": {
      "type": "string",
      "minLength": 1,
      "description": "Version of the tool the profile was scored against."
    },
    "corpus_version": {
      "type": "string",
      "minLength": 1,
      "description": "agent-egress-bench corpus version (matches gauntlet summary corpus_version)."
    },
    "corpus_sha256": {
      "type": "string",
      "pattern": "^[0-9a-f]{64}$",
      "description": "SHA-256 of the corpus content the profile was scored against. Lower-case hex."
    },
    "tool_profile_sha256": {
      "type": "string",
      "pattern": "^[0-9a-f]{64}$",
      "description": "SHA-256 of the tool-profile.json used at run time. Lower-case hex."
    },
    "capability_registry": {
      "type": "object",
      "additionalProperties": false,
      "required": ["id", "format", "revision", "sha256"],
      "properties": {
        "id": {"type": "string", "minLength": 1},
        "format": {"type": "integer", "minimum": 1},
        "revision": {"type": "integer", "minimum": 1},
        "sha256": {"type": "string", "pattern": "^[0-9a-f]{64}$"}
      }
    },
    "verifier": {
      "type": "object",
      "description": "Declarative metadata about the tool's receipt verifier (the thing a relying party uses to validate receipts offline).",
      "required": [
        "shipped",
        "open_source",
        "verifier_url",
        "license",
        "exit_code_contract"
      ],
      "additionalProperties": false,
      "properties": {
        "shipped": {
          "type": "boolean",
          "description": "True if the tool ships a verifier binary or library that consumers can run."
        },
        "open_source": {
          "type": "boolean",
          "description": "True if the verifier source is available under a recognized OSI license."
        },
        "verifier_url": {
          "type": ["string", "null"],
          "description": "URL to the verifier source or release. Null if no verifier ships."
        },
        "license": {
          "type": ["string", "null"],
          "description": "SPDX identifier or license name of the verifier source. Null if no verifier ships."
        },
        "exit_code_contract": {
          "type": ["string", "null"],
          "description": "Documented exit-code mapping (e.g. \"0 valid, 1 invalid, 2 error, 64 usage\"). Null if no verifier ships."
        }
      }
    },
    "summary": {
      "type": "object",
      "description": "Counts derived from per_case. Each count must equal the number of per_case rows whose corresponding dimension equals the indicated value.",
      "required": [
        "blocked_yes_count",
        "blocked_no_count",
        "explained_yes_count",
        "receipt_produced_yes_count",
        "receipt_independently_verifiable_yes_count",
        "false_positive_yes_count"
      ],
      "additionalProperties": false,
      "properties": {
        "blocked_yes_count": {
          "type": "integer",
          "minimum": 0,
          "description": "Number of per_case rows with blocked = yes."
        },
        "blocked_no_count": {
          "type": "integer",
          "minimum": 0,
          "description": "Number of per_case rows with blocked = no."
        },
        "explained_yes_count": {
          "type": "integer",
          "minimum": 0,
          "description": "Number of per_case rows with explained = yes."
        },
        "receipt_produced_yes_count": {
          "type": "integer",
          "minimum": 0,
          "description": "Number of per_case rows with receipt_produced = yes."
        },
        "receipt_independently_verifiable_yes_count": {
          "type": "integer",
          "minimum": 0,
          "description": "Number of per_case rows with receipt_independently_verifiable = yes."
        },
        "false_positive_yes_count": {
          "type": "integer",
          "minimum": 0,
          "description": "Number of per_case rows with false_positive = yes."
        }
      }
    },
    "per_case": {
      "type": "array",
      "description": "One row per corpus case the runner routed to the tool, plus every runner-produced unreachable row. An unreachable row records that this adapter had no exact delivery route; it remains visible as the unmeasured shape with blocked and false_positive both n/a and is excluded from outcome summary counts. Runner-error rows use the same unmeasured shape because a failed measurement is not an observed outcome in either direction. Historical not-applicable rows are not represented. Factual receipt observations, if any, remain represented and counted by their corresponding receipt dimensions.",
      "minItems": 0,
      "items": {
        "type": "object",
        "additionalProperties": false,
        "required": [
          "case_id",
          "blocked",
          "explained",
          "receipt_produced",
          "receipt_independently_verifiable",
          "false_positive"
        ],
        "properties": {
          "case_id": {
            "type": "string",
            "minLength": 1,
            "description": "Case identifier from the corpus (matches cases/ filename minus .json or the multi-file case directory name)."
          },
          "blocked": {
            "enum": ["yes", "no", "n/a"],
            "description": "Did the tool prevent the action? n/a for an allow-expected benign baseline or an unmeasured runner-error row."
          },
          "explained": {
            "enum": ["yes", "no"],
            "description": "Did the tool produce a machine-readable or human-readable explanation tied to this action? Boolean only; quality is not graded."
          },
          "receipt_produced": {
            "enum": ["yes", "no"],
            "description": "Did the tool emit a structured signed receipt for this action (action type, target, verdict, principal, signature, chain or timestamp)?"
          },
          "receipt_independently_verifiable": {
            "enum": ["yes", "partial", "no"],
            "description": "Can a third party verify the receipt offline against a pinned public key using an open-source verifier with a public conformance corpus? partial means internal-consistency-only (hash chain valid but no pinned signer)."
          },
          "false_positive": {
            "enum": ["yes", "no", "n/a"],
            "description": "Did the tool block a benign baseline case? n/a on malicious cases or an unmeasured runner-error row."
          },
          "receipt_observation_reason": {
            "type": "string",
            "minLength": 1,
            "description": "Optional runner-observed reason when receipt production or independent verification could not be established, for example no matching receipt, ambiguous correlation, unreadable evidence, verifier timeout, or verifier non-zero exit."
          }
        },
        "allOf": [
          {
            "title": "blocked vs false_positive consistency",
            "description": "Malicious cases (expected verdict block) carry blocked in {yes, no} and false_positive = n/a. Benign cases (expected verdict allow) carry blocked = n/a and false_positive in {yes, no}. Runner-error rows are unmeasured and carry both dimensions as n/a.",
            "oneOf": [
              {
                "properties": {
                  "blocked": { "enum": ["yes", "no"] },
                  "false_positive": { "const": "n/a" }
                }
              },
              {
                "properties": {
                  "blocked": { "const": "n/a" },
                  "false_positive": { "enum": ["yes", "no"] }
                }
              },
              {
                "properties": {
                  "blocked": { "const": "n/a" },
                  "false_positive": { "const": "n/a" }
                }
              }
            ]
          },
          {
            "title": "receipt_produced gates verifiability",
            "description": "A case cannot be independently verifiable if no receipt was produced.",
            "if": {
              "properties": { "receipt_produced": { "const": "no" } },
              "required": ["receipt_produced"]
            },
            "then": {
              "properties": { "receipt_independently_verifiable": { "const": "no" } }
            }
          }
        ]
      }
    }
  }
}
